<?xml version="1.0"?>
<SimBase.Document Type="AceXML" version="1,0" xmlns:xsi="http://www.w3.org/2001/XMLSchema-instance" xsi:noNamespaceSchemaLocation="Gauges.xsd">
	<SimGauge.Gauge id="NVL_Main_Menu_Entry_Label">
		<Update>
			<Script>
				1 s0
				"Quadrant" s6 both
				0x00FF00 s1 both
			</Script>
		</Update>
		<Size>50,10</Size>
		<Element>
			<Include File="menu_item" />
		</Element>
		<MouseArea id="MouseArea">
			<Visible>
				TRUE
			</Visible>
			<FloatPosition>0.000,0.000</FloatPosition>
			<Size>50,10</Size>
			<MouseClick id="MouseClick">
				<KeyEvent>E:Change Camera Feed</KeyEvent>
			</MouseClick>
		</MouseArea>
	</SimGauge.Gauge>
</SimBase.Document>
