<?xml version="1.0"?>
<SimBase.Document Type="AceXML" version="1,0" xmlns:xsi="http://www.w3.org/2001/XMLSchema-instance" xsi:noNamespaceSchemaLocation="Gauges.xsd">
	<SimGauge.Gauge id="button-units">
		<Update>
			<Script>
				// Define the button text
				"Units" s6
				'Metric' 'English' 2 (U:UNITS) case s7 both
				" " s8 both

				// Define the button text colors
				(U:COLOR_ButtonText) s1 both
				r1 s2 both
				r1 s3 both

				(U:BLACKOUT SELECTED) ! s0 both
			</Script>
		</Update>
		<Size>70,60</Size>
		<Element>
			<Include File="icon-text" />
		</Element>
		<MouseArea id="MouseArea">
			<FloatPosition>0.000,0.000</FloatPosition>
			<Size>70,60</Size>
			<MouseClick id="MouseClick">
				<KeyEvent>E:TOGGLE UNITS</KeyEvent>
			</MouseClick>
		</MouseArea>
	</SimGauge.Gauge>
</SimBase.Document>
