<?xml version="1.0" ?>
<SimBase.Document Type="AceXML" version="1,0" xmlns:xsi="http://www.w3.org/2001/XMLSchema-instance" xsi:noNamespaceSchemaLocation="Gauges.xsd">
	<SimGauge.Gauge id="dial-speed">
		<Update>
			<!-- 
			r0 =	starting angle
			r1 =	total sweep angle (clockwise)
			r2 =	numbers for dial
			r3 =	current angle
			r5 =	sweep value for #10
			r6 =	normalized value of #10
			r7 =	normalized current value (range: 0-1)
			r8 =	high value
			r9 =	current value
			-->
			<Script>
				180 1.25 * s0		// start angle
				180 1.5 * s1 both	// sweep
				
				/* sample comment */

				(A:Vehicle Speed,km/h) (A:Vehicle Speed,mph) 2 (U:UNITS) case s9 both
				(B:Vehicle Speed.High,km/h) (B:Vehicle Speed.High,mph) 2 (U:UNITS) case s8 both
				r9 r8 / s7 both

			</Script>
		</Update>
		<Size>280,280</Size>
		<Element Context="group">
			<Position X="140" Y="140" />
			<Element Context="background">
				<Circle X="0" Y="0" Radius="140" FillColor="charcoal" />
				<Circle X="2" Y="2" Radius="137" LineWidth="4" LineColor="black" />
				<Circle X="0" Y="0" Radius="137" LineWidth="4" LineColor="darkgray" />
				<Select>
					<Expression>
						<Script>(U:UNITS)</Script>
					</Expression>
					<Case>
						<ExpressionResult>0</ExpressionResult>
						<GaugeText X="0" Y="40"
								   Font="sans-serif" Height="18" Color="white"
								   Align="center" VerticalAlign="top">
							<String>M.P.H.</String>
						</GaugeText>
					</Case>
					<Case>
						<ExpressionResult>1</ExpressionResult>
						<GaugeText X="0" Y="40"
								   Font="sans-serif" Height="18" Color="white"
								   Align="center" VerticalAlign="top">
							<String>km/h</String>
						</GaugeText>
					</Case>
				</Select>
				<Element>
					<ForLoop>
						<InitialExpression>
							<Script>
								180 1.25 * s0
								180 1.5 * s1 both
								0 s2 both
								0.0 s3 both

								(A:Vehicle Speed,km/h) (A:Vehicle Speed,mph) 2 (U:UNITS) case s9 both
								(B:Vehicle Speed.High,km/h) (B:Vehicle Speed.High,mph) 2 (U:UNITS) case s8 both
								5.0 r8 / r1 * s5 both
							</Script>
						</InitialExpression>
						<TestExpression>
							<Script>
								r3 r1 &lt;=
							</Script>
						</TestExpression>
						<IncrementExpression>
							<Script>
								r2 10 + s2
								r3 r5 + s3 both
							</Script>
						</IncrementExpression>
						<Rotation>r0 r3 -</Rotation>
						<Line LineColor="lightgray" LineWidth="1">
							<Point X="130" Y="0" />
							<Point X="122" Y="0" />
						</Line>
					</ForLoop>
					<ForLoop>
						<InitialExpression>
							<Script>
								180 1.25 * s0
								180 1.5 * s1 both
								0 s2 both
								0.0 s3 both

								(A:Vehicle Speed,km/h) (A:Vehicle Speed,mph) 2 (U:UNITS) case s9 both
								(B:Vehicle Speed.High,km/h) (B:Vehicle Speed.High,mph) 2 (U:UNITS) case s8 both
								10.0 r8 / r1 * s5 both
							</Script>
						</InitialExpression>
						<TestExpression>
							<Script>
								r3 r1 &lt;=
							</Script>
						</TestExpression>
						<IncrementExpression>
							<Script>
								r2 10 + s2
								r3 r5 + s3 both
							</Script>
						</IncrementExpression>
						<Rotation>r0 r3 -</Rotation>
						<Line LineColor="white" LineWidth="3">
							<Point X="132" Y="0" />
							<Point X="120" Y="0" />
						</Line>
						<Choose>
							<When>
								<Expression>
									<!--
									r8 < 120  ||  0 == (r2 % 20)
									-->
									<Script>
										r8 120 &lt;
										r2 20 % 0 ==
										||
									</Script>
								</Expression>
								<GaugeText X="100" Y="0"
										   Font="sans-serif" Height="26"
										   Color="white"
										   Align="center" VerticalAlign="middle">
									<String>%(r2)%!d!</String>
								</GaugeText>
							</When>
						</Choose>
					</ForLoop>
				</Element>
			</Element>
			<Element Context="foreground">
				<Element>
					<Rotation>r0 r7 r1 * - s5</Rotation>
					<Position X="6" Y="6" />
					<Polygon FillColor="black">
						<Point X="-30" Y="-3" />
						<Point X="118" Y="-1" />
						<Point X="120" Y="0" />
						<Point X="118" Y="1" />
						<Point X="-30" Y="3" />
						<Point X="-30" Y="-3" />
					</Polygon>
				</Element>
				<Circle X="6" Y="6"
						Radius="15" FillColor="black"
						LineColor="black" LineWidth="2" />
				<Element>
					<Rotation>r5</Rotation>
					<Polygon FillColor="red" LineColor="crimson">
						<Point X="-30" Y="-3" />
						<Point X="118" Y="-1" />
						<Point X="120" Y="0" />
						<Point X="118" Y="1" />
						<Point X="-30" Y="3" />
						<Point X="-30" Y="-3" />
					</Polygon>
				</Element>
				<Circle X="0" Y="0"
						Radius="15" FillColor="gray"
						LineColor="silver" LineWidth="2" />


			</Element>
		</Element>
	</SimGauge.Gauge>
</SimBase.Document>
